{
  "scenarioType": "SC-01",
  "planningContext": {
    "horizon": {
      "dateDebut": "2026-03-02",
      "dateFin": "2026-03-08"
    },
    "strategieScoring": "EXPLOITATION"
  },
  "scenarioParameters": {
    "resourceRef": {
      "kind": "SALARIE",
      "id": "SAL_123"
    },
    "dailyAmplitudeHours": 7.5,
    "shiftStart": "08:30",
    "shiftEndAlert": "16:00",
    "workedDays": ["MON", "TUE", "WED", "THU"],
    "holidayDates": []
  },
  "dataSet": {
    "creneaux": [],
    "ressources": {
      "salaries": [
        {
          "id": "SAL_123",
          "statut": "TEMPS_PLEIN",
          "sitesAutorises": [],
          "activitesCompatibles": []
        }
      ],
      "postesVirtuels": []
    }
  }
}